[
  {
    "id": "UC-001",
    "title": "予約登録",
    "actor": "SH-CUSTOMER",
    "description": "顧客が予約サイトにアクセスし、希望の日時とサービスを選択して予約を登録する。",
    "preconditions": [
      "顧客は予約サイトにアクセス可能である",
      "予約可能な日時と枠が存在する"
    ],
    "postconditions": [
      "予約が確定され、予約番号が発行される",
      "予約データがデータベースに保存される",
      "顧客に予約完了画面が表示される"
    ],
    "mainFlow": [
      {
        "step": 1,
        "description": "顧客が予約サイトにアクセスする",
        "actor": "Customer"
      },
      {
        "step": 2,
        "description": "カレンダーUIで空き状況を表示する",
        "actor": "System"
      },
      {
        "step": 3,
        "description": "顧客が希望の日時を選択する",
        "actor": "Customer"
      },
      {
        "step": 4,
        "description": "利用可能なサービスメニューを表示する",
        "actor": "System"
      },
      {
        "step": 5,
        "description": "顧客がサービスを選択する（複数選択可）",
        "actor": "Customer"
      },
      {
        "step": 6,
        "description": "顧客情報入力フォームを表示する",
        "actor": "System"
      },
      {
        "step": 7,
        "description": "顧客が氏名、電話番号、メールアドレス、特記事項を入力する",
        "actor": "Customer"
      },
      {
        "step": 8,
        "description": "入力内容を検証する",
        "actor": "System"
      },
      {
        "step": 9,
        "description": "予約内容の確認画面を表示する",
        "actor": "System"
      },
      {
        "step": 10,
        "description": "顧客が予約内容を確認し、確定ボタンをクリックする",
        "actor": "Customer"
      },
      {
        "step": 11,
        "description": "予約を確定し、予約番号を発行する",
        "actor": "System"
      },
      {
        "step": 12,
        "description": "予約完了画面を表示し、予約番号を表示する",
        "actor": "System"
      }
    ],
    "alternativeFlows": [
      {
        "id": "AF-1",
        "description": "選択した日時に空きがない場合",
        "branchFrom": 3,
        "steps": [
          {
            "step": 1,
            "description": "空きがないことをメッセージで通知する"
          },
          {
            "step": 2,
            "description": "別の日時の選択を促す"
          }
        ],
        "returnTo": 3
      },
      {
        "id": "AF-2",
        "description": "入力内容にエラーがある場合",
        "branchFrom": 8,
        "steps": [
          {
            "step": 1,
            "description": "エラー内容を表示する"
          },
          {
            "step": 2,
            "description": "該当フィールドをハイライト表示する"
          }
        ],
        "returnTo": 7
      }
    ],
    "exceptionFlows": [
      {
        "id": "EF-1",
        "description": "予約確定中にシステムエラーが発生",
        "steps": [
          {
            "step": 1,
            "description": "入力内容を一時保存する"
          },
          {
            "step": 2,
            "description": "エラーメッセージを表示する"
          },
          {
            "step": 3,
            "description": "顧客にリトライを促す"
          }
        ]
      }
    ],
    "relatedRequirements": [
      "FR-001"
    ],
    "priority": "critical",
    "frequency": "very-high"
  },
  {
    "id": "UC-002",
    "title": "予約変更",
    "actor": "SH-CUSTOMER",
    "description": "顧客が既存の予約内容（日時やサービス）を変更する。",
    "preconditions": [
      "顧客が予約番号を保持している",
      "予約がキャンセルされていない",
      "変更可能な期限内である"
    ],
    "postconditions": [
      "予約内容が更新される",
      "変更完了画面が表示される"
    ],
    "mainFlow": [
      {
        "step": 1,
        "description": "顧客が予約確認ページにアクセスする",
        "actor": "Customer"
      },
      {
        "step": 2,
        "description": "予約番号の入力を求める",
        "actor": "System"
      },
      {
        "step": 3,
        "description": "顧客が予約番号を入力する",
        "actor": "Customer"
      },
      {
        "step": 4,
        "description": "予約内容を検索し、表示する",
        "actor": "System"
      },
      {
        "step": 5,
        "description": "顧客が「変更」ボタンをクリックする",
        "actor": "Customer"
      },
      {
        "step": 6,
        "description": "変更可能な項目を編集可能にする",
        "actor": "System"
      },
      {
        "step": 7,
        "description": "顧客が日時またはサービスを変更する",
        "actor": "Customer"
      },
      {
        "step": 8,
        "description": "変更内容を検証する",
        "actor": "System"
      },
      {
        "step": 9,
        "description": "変更内容の確認画面を表示する",
        "actor": "System"
      },
      {
        "step": 10,
        "description": "顧客が確定ボタンをクリックする",
        "actor": "Customer"
      },
      {
        "step": 11,
        "description": "予約内容を更新する",
        "actor": "System"
      },
      {
        "step": 12,
        "description": "変更完了画面を表示する",
        "actor": "System"
      }
    ],
    "alternativeFlows": [
      {
        "id": "AF-1",
        "description": "予約番号が見つからない場合",
        "branchFrom": 4,
        "steps": [
          {
            "step": 1,
            "description": "予約が見つからないことを通知する"
          },
          {
            "step": 2,
            "description": "予約番号の再入力を促す"
          }
        ],
        "returnTo": 3
      },
      {
        "id": "AF-2",
        "description": "変更期限を過ぎている場合",
        "branchFrom": 5,
        "steps": [
          {
            "step": 1,
            "description": "変更期限を過ぎていることを通知する"
          },
          {
            "step": 2,
            "description": "店舗への直接連絡を案内する"
          }
        ]
      }
    ],
    "exceptionFlows": [],
    "relatedRequirements": [
      "FR-002"
    ],
    "priority": "high",
    "frequency": "high"
  },
  {
    "id": "UC-003",
    "title": "予約キャンセル",
    "actor": "SH-CUSTOMER",
    "description": "顧客が既存の予約をキャンセルする。",
    "preconditions": [
      "顧客が予約番号を保持している",
      "予約がキャンセルされていない",
      "キャンセル可能な期限内である"
    ],
    "postconditions": [
      "予約がキャンセル状態になる",
      "予約枠が再度利用可能になる",
      "キャンセル完了画面が表示される"
    ],
    "mainFlow": [
      {
        "step": 1,
        "description": "顧客が予約確認ページにアクセスする",
        "actor": "Customer"
      },
      {
        "step": 2,
        "description": "予約番号の入力を求める",
        "actor": "System"
      },
      {
        "step": 3,
        "description": "顧客が予約番号を入力する",
        "actor": "Customer"
      },
      {
        "step": 4,
        "description": "予約内容を検索し、表示する",
        "actor": "System"
      },
      {
        "step": 5,
        "description": "顧客が「キャンセル」ボタンをクリックする",
        "actor": "Customer"
      },
      {
        "step": 6,
        "description": "キャンセル確認ダイアログを表示する",
        "actor": "System"
      },
      {
        "step": 7,
        "description": "顧客がキャンセルを確定する",
        "actor": "Customer"
      },
      {
        "step": 8,
        "description": "予約をキャンセル状態に更新する",
        "actor": "System"
      },
      {
        "step": 9,
        "description": "予約枠を解放する",
        "actor": "System"
      },
      {
        "step": 10,
        "description": "キャンセル完了画面を表示する",
        "actor": "System"
      }
    ],
    "alternativeFlows": [
      {
        "id": "AF-1",
        "description": "キャンセル期限を過ぎている場合",
        "branchFrom": 5,
        "steps": [
          {
            "step": 1,
            "description": "キャンセル期限を過ぎていることを通知する"
          },
          {
            "step": 2,
            "description": "店舗への直接連絡を案内する"
          }
        ]
      }
    ],
    "exceptionFlows": [],
    "relatedRequirements": [
      "FR-002"
    ],
    "priority": "high",
    "frequency": "medium"
  },
  {
    "id": "UC-004",
    "title": "予約一覧確認",
    "actor": "SH-STAFF",
    "description": "店舗スタッフが当日または特定期間の予約一覧を確認する。",
    "preconditions": [
      "店舗スタッフが管理画面にログインしている"
    ],
    "postconditions": [
      "予約一覧が表示される",
      "予約詳細を確認できる"
    ],
    "mainFlow": [
      {
        "step": 1,
        "description": "店舗スタッフが管理画面にログインする",
        "actor": "Staff"
      },
      {
        "step": 2,
        "description": "ダッシュボードを表示する",
        "actor": "System"
      },
      {
        "step": 3,
        "description": "スタッフが「予約一覧」メニューを選択する",
        "actor": "Staff"
      },
      {
        "step": 4,
        "description": "デフォルトで当日の予約一覧を表示する",
        "actor": "System"
      },
      {
        "step": 5,
        "description": "スタッフが日付や表示形式（日別/週別）を変更する",
        "actor": "Staff"
      },
      {
        "step": 6,
        "description": "指定された条件で予約一覧を再表示する",
        "actor": "System"
      },
      {
        "step": 7,
        "description": "スタッフが予約をクリックして詳細を確認する",
        "actor": "Staff"
      },
      {
        "step": 8,
        "description": "予約詳細情報を表示する",
        "actor": "System"
      }
    ],
    "alternativeFlows": [
      {
        "id": "AF-1",
        "description": "ステータスでフィルタリングする場合",
        "branchFrom": 5,
        "steps": [
          {
            "step": 1,
            "description": "スタッフがステータス（確定/キャンセル/完了）を選択する"
          },
          {
            "step": 2,
            "description": "選択されたステータスの予約のみを表示する"
          }
        ],
        "returnTo": 6
      },
      {
        "id": "AF-2",
        "description": "顧客名で検索する場合",
        "branchFrom": 5,
        "steps": [
          {
            "step": 1,
            "description": "スタッフが顧客名を入力する"
          },
          {
            "step": 2,
            "description": "該当する予約を検索して表示する"
          }
        ],
        "returnTo": 6
      }
    ],
    "exceptionFlows": [],
    "relatedRequirements": [
      "FR-003"
    ],
    "priority": "high",
    "frequency": "very-high"
  },
  {
    "id": "UC-005",
    "title": "予約ステータス更新",
    "actor": "SH-STAFF",
    "description": "店舗スタッフが予約のステータス（確定/完了/ノーショー）を更新する。",
    "preconditions": [
      "店舗スタッフが管理画面にログインしている",
      "更新対象の予約が存在する"
    ],
    "postconditions": [
      "予約ステータスが更新される"
    ],
    "mainFlow": [
      {
        "step": 1,
        "description": "スタッフが予約一覧または予約詳細画面を開く",
        "actor": "Staff"
      },
      {
        "step": 2,
        "description": "スタッフが更新対象の予約を選択する",
        "actor": "Staff"
      },
      {
        "step": 3,
        "description": "スタッフがステータス変更ボタンをクリックする",
        "actor": "Staff"
      },
      {
        "step": 4,
        "description": "利用可能なステータス一覧を表示する",
        "actor": "System"
      },
      {
        "step": 5,
        "description": "スタッフが新しいステータスを選択する",
        "actor": "Staff"
      },
      {
        "step": 6,
        "description": "予約ステータスを更新する",